<xs:schema attributeFormDefault="unqualified" elementFormDefault="qualified" xmlns:xs="http://www.w3.org/2001/XMLSchema">
    <xs:element name="list">
        <xs:complexType>
            <xs:sequence>
                <xs:element name="premium" maxOccurs="unbounded" minOccurs="0">
                    <xs:complexType>
                        <xs:sequence>
                            <xs:element name="rates" maxOccurs="unbounded" minOccurs="0">
                                <xs:complexType>
                                    <xs:simpleContent>
                                        <xs:extension base="xs:string">
                                            <xs:attribute type="xs:float" name="expRate" use="optional"/>
                                            <xs:attribute type="xs:float" name="spRate" use="optional"/>
                                            <xs:attribute type="xs:float" name="dropRate" use="optional"/>
                                            <xs:attribute type="xs:float" name="dropChance" use="optional"/>
                                            <xs:attribute type="xs:float" name="dropAmount" use="optional"/>
                                            <xs:attribute type="xs:float" name="spoilRate" use="optional"/>
                                            <xs:attribute type="xs:float" name="spoilChance" use="optional"/>
                                            <xs:attribute type="xs:float" name="spoilAmount" use="optional"/>
                                            <xs:attribute type="xs:float" name="adenaDropRate" use="optional"/>
                                            <xs:attribute type="xs:float" name="weightLimitRate" use="optional"/>
                                            <xs:attribute type="xs:float" name="craftChance" use="optional"/>
                                            <xs:attribute type="xs:float" name="mCraftChance" use="optional"/>
                                            <xs:attribute type="xs:float" name="doubleCraftChance" use="optional"/>
                                            <xs:attribute type="xs:float" name="extractableRate" use="optional"/>
                                            <xs:attribute type="xs:float" name="questDropRate" use="optional"/>
                                            <xs:attribute type="xs:float" name="questRewardRate" use="optional"/>
                                            <xs:attribute type="xs:float" name="petExpRate" use="optional"/>
                                            <xs:attribute type="xs:float" name="raidDropChance" use="optional"/>
                                        </xs:extension>
                                    </xs:simpleContent>
                                </xs:complexType>
                            </xs:element>
                            <xs:element name="time">
                                <xs:complexType>
                                    <xs:simpleContent>
                                        <xs:extension base="xs:string">
                                            <xs:attribute type="xs:byte" name="days" use="optional"/>
                                            <xs:attribute type="xs:byte" name="hours" use="optional"/>
                                            <xs:attribute type="xs:byte" name="minutes" use="optional"/>
                                        </xs:extension>
                                    </xs:simpleContent>
                                </xs:complexType>
                            </xs:element>
                            <xs:element name="price">
                                <xs:complexType>
                                    <xs:simpleContent>
                                        <xs:extension base="xs:string">
                                            <xs:attribute type="xs:int" name="itemId" use="optional"/>
                                            <xs:attribute type="xs:byte" name="itemAmount" use="optional"/>
                                        </xs:extension>
                                    </xs:simpleContent>
                                </xs:complexType>
                            </xs:element>
                        </xs:sequence>
                        <xs:attribute type="xs:byte" name="id" use="optional"/>
                        <xs:attribute type="xs:string" name="name" use="optional"/>
                        <xs:attribute type="xs:string" name="icon" use="optional"/>
                        <xs:attribute type="xs:string" name="aura" use="optional"/>
                        <xs:attribute type="xs:string" name="main" use="optional"/>
                    </xs:complexType>
                </xs:element>
            </xs:sequence>
        </xs:complexType>
    </xs:element>
</xs:schema>